{
  "entities": [
    {
      "aliases": [],
      "asset_id": "builtin:axis:argument-中性简报",
      "dependencies": [],
      "kind": "axis",
      "lifecycle": "draft",
      "name": "论证模式：中性简报",
      "path": "canonical/axes/argument/argument-中性简报/manifest.json",
      "revision": "ddc81de4fdbffc12"
    },
    {
      "aliases": [],
      "asset_id": "builtin:axis:argument-主旨演讲",
      "dependencies": [],
      "kind": "axis",
      "lifecycle": "draft",
      "name": "叙事方法论：主旨演讲（narrative-keynote）",
      "path": "canonical/axes/argument/argument-主旨演讲/manifest.json",
      "revision": "e6f4030bd0406edb"
    },
    {
      "aliases": [],
      "asset_id": "builtin:axis:argument-事故复盘",
      "dependencies": [],
      "kind": "axis",
      "lifecycle": "draft",
      "name": "叙事方法论：事故复盘（incident-postmortem）",
      "path": "canonical/axes/argument/argument-事故复盘/manifest.json",
      "revision": "3a1a6293cc7cfc89"
    },
    {
      "aliases": [],
      "asset_id": "builtin:axis:argument-产品发布",
      "dependencies": [],
      "kind": "axis",
      "lifecycle": "draft",
      "name": "叙事方法论：产品发布（product-launch）",
      "path": "canonical/axes/argument/argument-产品发布/manifest.json",
      "revision": "b71dfec5807e9470"
    },
    {
      "aliases": [],
      "asset_id": "builtin:axis:argument-创意提案",
      "dependencies": [],
      "kind": "axis",
      "lifecycle": "draft",
      "name": "叙事方法论：创意提案（creative-pitch）",
      "path": "canonical/axes/argument/argument-创意提案/manifest.json",
      "revision": "93206a13e9b93233"
    },
    {
      "aliases": [],
      "asset_id": "builtin:axis:argument-叙事拍库",
      "dependencies": [],
      "kind": "axis",
      "lifecycle": "draft",
      "name": "叙事拍库：叙事方法论层的选配组件（arc_beat 精选）",
      "path": "canonical/axes/argument/argument-叙事拍库/manifest.json",
      "revision": "08a1aefa3ce197f8"
    },
    {
      "aliases": [],
      "asset_id": "builtin:axis:argument-咨询决策",
      "dependencies": [],
      "kind": "axis",
      "lifecycle": "draft",
      "name": "叙事方法论：咨询决策（consulting-decision）",
      "path": "canonical/axes/argument/argument-咨询决策/manifest.json",
      "revision": "4f8602a590097c6e"
    },
    {
      "aliases": [],
      "asset_id": "builtin:axis:argument-学术五拍",
      "dependencies": [],
      "kind": "axis",
      "lifecycle": "draft",
      "name": "论证模式：学术五拍",
      "path": "canonical/axes/argument/argument-学术五拍/manifest.json",
      "revision": "92034f41e8062d52"
    },
    {
      "aliases": [],
      "asset_id": "builtin:axis:argument-学术研究报告",
      "dependencies": [],
      "kind": "axis",
      "lifecycle": "draft",
      "name": "叙事方法论：学术研究报告（academic-research）",
      "path": "canonical/axes/argument/argument-学术研究报告/manifest.json",
      "revision": "453a5d1efd97990f"
    },
    {
      "aliases": [],
      "asset_id": "builtin:axis:argument-工作坊教学",
      "dependencies": [],
      "kind": "axis",
      "lifecycle": "draft",
      "name": "叙事方法论：工作坊教学（workshop-teaching）",
      "path": "canonical/axes/argument/argument-工作坊教学/manifest.json",
      "revision": "695381d739dcedc5"
    },
    {
      "aliases": [],
      "asset_id": "builtin:axis:argument-技术深潜",
      "dependencies": [],
      "kind": "axis",
      "lifecycle": "draft",
      "name": "叙事方法论：技术深潜（technical-deepdive）",
      "path": "canonical/axes/argument/argument-技术深潜/manifest.json",
      "revision": "3a93c9e4e114dfd0"
    },
    {
      "aliases": [],
      "asset_id": "builtin:axis:argument-故事弧",
      "dependencies": [],
      "kind": "axis",
      "lifecycle": "draft",
      "name": "论证模式：故事弧",
      "path": "canonical/axes/argument/argument-故事弧/manifest.json",
      "revision": "9c4e2abdebef5ec9"
    },
    {
      "aliases": [],
      "asset_id": "builtin:axis:argument-教学分解",
      "dependencies": [],
      "kind": "axis",
      "lifecycle": "draft",
      "name": "论证模式：教学分解",
      "path": "canonical/axes/argument/argument-教学分解/manifest.json",
      "revision": "e926e4498d8eb21f"
    },
    {
      "aliases": [],
      "asset_id": "builtin:axis:argument-方案提案",
      "dependencies": [],
      "kind": "axis",
      "lifecycle": "draft",
      "name": "叙事方法论：方案提案（solution-proposal）",
      "path": "canonical/axes/argument/argument-方案提案/manifest.json",
      "revision": "2cec01900ef2f22b"
    },
    {
      "aliases": [],
      "asset_id": "builtin:axis:argument-科普讲解",
      "dependencies": [],
      "kind": "axis",
      "lifecycle": "draft",
      "name": "叙事方法论：科普讲解（science-explainer）",
      "path": "canonical/axes/argument/argument-科普讲解/manifest.json",
      "revision": "f50475bc2046abc4"
    },
    {
      "aliases": [],
      "asset_id": "builtin:axis:argument-经营复盘",
      "dependencies": [],
      "kind": "axis",
      "lifecycle": "draft",
      "name": "叙事方法论：经营复盘（operating-review）",
      "path": "canonical/axes/argument/argument-经营复盘/manifest.json",
      "revision": "2d5d4bcf833802bc"
    },
    {
      "aliases": [],
      "asset_id": "builtin:axis:argument-结论先行金字塔",
      "dependencies": [],
      "kind": "axis",
      "lifecycle": "draft",
      "name": "论证模式：结论先行金字塔",
      "path": "canonical/axes/argument/argument-结论先行金字塔/manifest.json",
      "revision": "570c71d8842d84ed"
    },
    {
      "aliases": [],
      "asset_id": "builtin:axis:argument-融资路演",
      "dependencies": [],
      "kind": "axis",
      "lifecycle": "draft",
      "name": "叙事方法论：融资路演（investor-pitch）",
      "path": "canonical/axes/argument/argument-融资路演/manifest.json",
      "revision": "7106cbe8ae714742"
    },
    {
      "aliases": [],
      "asset_id": "builtin:axis:argument-视觉展示",
      "dependencies": [],
      "kind": "axis",
      "lifecycle": "draft",
      "name": "论证模式：视觉展示",
      "path": "canonical/axes/argument/argument-视觉展示/manifest.json",
      "revision": "40a06c860f265681"
    },
    {
      "aliases": [],
      "asset_id": "builtin:axis:chart-思维导图",
      "dependencies": [],
      "kind": "axis",
      "lifecycle": "draft",
      "name": "图表语法：思维导图（Mindmap）",
      "path": "canonical/axes/chart/chart-思维导图/manifest.json",
      "revision": "f27776d1e10ea779"
    },
    {
      "aliases": [],
      "asset_id": "builtin:axis:chart-折线图",
      "dependencies": [],
      "kind": "axis",
      "lifecycle": "draft",
      "name": "图表语法：折线图（Line）",
      "path": "canonical/axes/chart/chart-折线图/manifest.json",
      "revision": "ba1ba577579080c3"
    },
    {
      "aliases": [],
      "asset_id": "builtin:axis:chart-时序图",
      "dependencies": [],
      "kind": "axis",
      "lifecycle": "draft",
      "name": "图表语法：时序图（SequenceDiagram）",
      "path": "canonical/axes/chart/chart-时序图/manifest.json",
      "revision": "ef0621d58b2c75a0"
    },
    {
      "aliases": [],
      "asset_id": "builtin:axis:chart-时间线",
      "dependencies": [],
      "kind": "axis",
      "lifecycle": "draft",
      "name": "图表语法：时间线（Timeline）",
      "path": "canonical/axes/chart/chart-时间线/manifest.json",
      "revision": "2051c0a2b6e116ec"
    },
    {
      "aliases": [],
      "asset_id": "builtin:axis:chart-柱状图",
      "dependencies": [],
      "kind": "axis",
      "lifecycle": "draft",
      "name": "图表语法：柱状图（Bar）",
      "path": "canonical/axes/chart/chart-柱状图/manifest.json",
      "revision": "cdd0ef0c3c8e9dac"
    },
    {
      "aliases": [],
      "asset_id": "builtin:axis:chart-树视图",
      "dependencies": [],
      "kind": "axis",
      "lifecycle": "draft",
      "name": "图表语法：树视图（TreeView）",
      "path": "canonical/axes/chart/chart-树视图/manifest.json",
      "revision": "23511ccc612f1d4d"
    },
    {
      "aliases": [],
      "asset_id": "builtin:axis:chart-桑基图",
      "dependencies": [],
      "kind": "axis",
      "lifecycle": "draft",
      "name": "图表语法：桑基图（Sankey）",
      "path": "canonical/axes/chart/chart-桑基图/manifest.json",
      "revision": "60dea8b2e62fad86"
    },
    {
      "aliases": [],
      "asset_id": "builtin:axis:chart-流程图",
      "dependencies": [],
      "kind": "axis",
      "lifecycle": "draft",
      "name": "图表语法：流程图（Flowchart）",
      "path": "canonical/axes/chart/chart-流程图/manifest.json",
      "revision": "8fa944327e63556f"
    },
    {
      "aliases": [],
      "asset_id": "builtin:axis:chart-瀑布桥图",
      "dependencies": [],
      "kind": "axis",
      "lifecycle": "draft",
      "name": "图表语法：瀑布桥图（Waterfall / Bridge）",
      "path": "canonical/axes/chart/chart-瀑布桥图/manifest.json",
      "revision": "c67ec505344832de"
    },
    {
      "aliases": [],
      "asset_id": "builtin:axis:chart-状态图",
      "dependencies": [],
      "kind": "axis",
      "lifecycle": "draft",
      "name": "图表语法：状态图（StateDiagram）",
      "path": "canonical/axes/chart/chart-状态图/manifest.json",
      "revision": "cacd5c8ac8044322"
    },
    {
      "aliases": [],
      "asset_id": "builtin:axis:chart-甘特图",
      "dependencies": [],
      "kind": "axis",
      "lifecycle": "draft",
      "name": "图表语法：甘特图（Gantt）",
      "path": "canonical/axes/chart/chart-甘特图/manifest.json",
      "revision": "f5fc0e9f1ec187dc"
    },
    {
      "aliases": [],
      "asset_id": "builtin:axis:chart-用户旅程",
      "dependencies": [],
      "kind": "axis",
      "lifecycle": "draft",
      "name": "图表语法：用户旅程（UserJourney）",
      "path": "canonical/axes/chart/chart-用户旅程/manifest.json",
      "revision": "308e56238867858b"
    },
    {
      "aliases": [],
      "asset_id": "builtin:axis:chart-矩阵图",
      "dependencies": [],
      "kind": "axis",
      "lifecycle": "draft",
      "name": "图表语法：2×2 矩阵（Matrix）",
      "path": "canonical/axes/chart/chart-矩阵图/manifest.json",
      "revision": "748cce38e34e82b7"
    },
    {
      "aliases": [],
      "asset_id": "builtin:axis:chart-类图",
      "dependencies": [],
      "kind": "axis",
      "lifecycle": "draft",
      "name": "图表语法：类图（ClassDiagram）",
      "path": "canonical/axes/chart/chart-类图/manifest.json",
      "revision": "8ccea1148f3830b4"
    },
    {
      "aliases": [],
      "asset_id": "builtin:axis:chart-统计图标注",
      "dependencies": [],